{
  "schema_version": 1,
  "policy_id": "ATLAS-CAUSAL-PROVENANCE-POLICY-V1",
  "identity_policy": {
    "canonical_json": "sorted-keys-utf8-no-insignificant-whitespace-no-trailing-newline",
    "request_id_prefix": "atlas-provenance-request:sha256:",
    "result_id_prefix": "atlas-provenance-result:sha256:",
    "node_id_prefix": "atlas-provenance-node:sha256:",
    "relation_id_prefix": "atlas-provenance-relation:sha256:",
    "path_id_prefix": "atlas-provenance-path:sha256:",
    "evidence_id_prefix": "atlas-provenance-evidence:sha256:",
    "statement_id_prefix": "atlas-provenance-statement:sha256:",
    "source_span_byte_interval": "inclusive-zero-based"
  },
  "node_classes": [
    "source-span",
    "declared-object",
    "configuration-entry",
    "script-operation",
    "lifecycle-event",
    "runtime-state",
    "final-runtime-record",
    "explanation"
  ],
  "causal_strengths": [
    "ownership",
    "possibility",
    "participation",
    "transformation",
    "causation",
    "identity",
    "observation",
    "derivation"
  ],
  "relation_policies": [
    {
      "predicate": "declares",
      "direction": "subject-earlier-or-derivation-input-to-object-result",
      "subject_classes": [
        "source-span"
      ],
      "object_classes": [
        "declared-object"
      ],
      "permitted_strengths": [
        "ownership"
      ],
      "evidence_requirements": {
        "ownership": [
          "source-span"
        ]
      },
      "lifecycle_requirement": "forbidden",
      "closure_role": "context-only",
      "meaning": "The exact source span defines the declared object; this proves declaration ownership, not execution or final runtime presence."
    },
    {
      "predicate": "registers",
      "direction": "subject-earlier-or-derivation-input-to-object-result",
      "subject_classes": [
        "declared-object",
        "script-operation",
        "lifecycle-event"
      ],
      "object_classes": [
        "runtime-state"
      ],
      "permitted_strengths": [
        "participation",
        "causation"
      ],
      "evidence_requirements": {
        "participation": [
          "stage-execution"
        ],
        "causation": [
          "stage-execution",
          "state-transition"
        ]
      },
      "lifecycle_requirement": "required",
      "closure_role": "causal-transition",
      "meaning": "The subject participates in or, with exact execution and endpoint evidence, causes registration of the object runtime state."
    },
    {
      "predicate": "loads_configuration",
      "direction": "subject-earlier-or-derivation-input-to-object-result",
      "subject_classes": [
        "configuration-entry"
      ],
      "object_classes": [
        "lifecycle-event",
        "runtime-state"
      ],
      "permitted_strengths": [
        "participation",
        "causation"
      ],
      "evidence_requirements": {
        "participation": [
          "configuration-selection"
        ],
        "causation": [
          "configuration-selection",
          "state-transition"
        ]
      },
      "lifecycle_requirement": "required",
      "closure_role": "conditional-transition",
      "meaning": "The exact configuration entry is consumed at the named lifecycle stage; causation additionally requires an exact selected value and downstream endpoint."
    },
    {
      "predicate": "invokes",
      "direction": "subject-earlier-or-derivation-input-to-object-result",
      "subject_classes": [
        "source-span",
        "script-operation",
        "lifecycle-event"
      ],
      "object_classes": [
        "script-operation",
        "lifecycle-event"
      ],
      "permitted_strengths": [
        "possibility",
        "participation",
        "causation"
      ],
      "evidence_requirements": {
        "possibility": [
          "source-span"
        ],
        "participation": [
          "stage-execution"
        ],
        "causation": [
          "source-span",
          "stage-execution"
        ]
      },
      "lifecycle_requirement": "optional",
      "closure_role": "conditional-transition",
      "meaning": "A static call site proves only possibility; participation or causation requires accepted execution and lifecycle evidence."
    },
    {
      "predicate": "copies",
      "direction": "subject-earlier-or-derivation-input-to-object-result",
      "subject_classes": [
        "declared-object",
        "runtime-state"
      ],
      "object_classes": [
        "runtime-state"
      ],
      "permitted_strengths": [
        "transformation",
        "causation"
      ],
      "evidence_requirements": {
        "transformation": [
          "state-transition"
        ],
        "causation": [
          "stage-execution",
          "state-transition"
        ]
      },
      "lifecycle_requirement": "required",
      "closure_role": "causal-transition",
      "meaning": "The object is a separately identified runtime state copied from the exact declared or runtime predecessor; the operation belongs in transition evidence and structural similarity alone cannot establish this relation."
    },
    {
      "predicate": "transforms",
      "direction": "subject-earlier-or-derivation-input-to-object-result",
      "subject_classes": [
        "declared-object",
        "runtime-state"
      ],
      "object_classes": [
        "runtime-state"
      ],
      "permitted_strengths": [
        "transformation",
        "causation"
      ],
      "evidence_requirements": {
        "transformation": [
          "state-transition"
        ],
        "causation": [
          "stage-execution",
          "state-transition"
        ]
      },
      "lifecycle_requirement": "required",
      "closure_role": "causal-transition",
      "meaning": "The object is an exact after-state produced from the declared or runtime predecessor by a non-identity transformation; the operation belongs in transition evidence."
    },
    {
      "predicate": "mutates",
      "direction": "subject-earlier-or-derivation-input-to-object-result",
      "subject_classes": [
        "runtime-state"
      ],
      "object_classes": [
        "runtime-state"
      ],
      "permitted_strengths": [
        "transformation",
        "causation"
      ],
      "evidence_requirements": {
        "transformation": [
          "state-transition"
        ],
        "causation": [
          "stage-execution",
          "state-transition"
        ]
      },
      "lifecycle_requirement": "required",
      "closure_role": "causal-transition",
      "meaning": "The subject and object are exact before and after runtime states; the bound mutation operation belongs in transition evidence."
    },
    {
      "predicate": "removes",
      "direction": "subject-earlier-or-derivation-input-to-object-result",
      "subject_classes": [
        "runtime-state"
      ],
      "object_classes": [
        "runtime-state"
      ],
      "permitted_strengths": [
        "transformation",
        "causation"
      ],
      "evidence_requirements": {
        "transformation": [
          "state-transition"
        ],
        "causation": [
          "stage-execution",
          "state-transition"
        ]
      },
      "lifecycle_requirement": "required",
      "closure_role": "causal-transition",
      "meaning": "The subject is the exact predecessor and the object is its exact tombstone or post-removal state; the removal operation belongs in transition evidence, and absence from one capture is insufficient."
    },
    {
      "predicate": "replaces",
      "direction": "subject-earlier-or-derivation-input-to-object-result",
      "subject_classes": [
        "runtime-state"
      ],
      "object_classes": [
        "runtime-state"
      ],
      "permitted_strengths": [
        "transformation",
        "causation"
      ],
      "evidence_requirements": {
        "transformation": [
          "state-transition"
        ],
        "causation": [
          "stage-execution",
          "state-transition"
        ]
      },
      "lifecycle_requirement": "required",
      "closure_role": "causal-transition",
      "meaning": "The subject and object are exact predecessor and successor runtime states; the replacement operation belongs in transition evidence, and remove/add observations remain ordered."
    },
    {
      "predicate": "reconciles_to",
      "direction": "subject-earlier-or-derivation-input-to-object-result",
      "subject_classes": [
        "runtime-state",
        "final-runtime-record"
      ],
      "object_classes": [
        "runtime-state",
        "final-runtime-record"
      ],
      "permitted_strengths": [
        "identity"
      ],
      "evidence_requirements": {
        "identity": [
          "identity-reconciliation"
        ]
      },
      "lifecycle_requirement": "forbidden",
      "closure_role": "identity-only",
      "meaning": "Exact typed identity and accepted reconciliation evidence connect profile records; this relation does not establish causal creation."
    },
    {
      "predicate": "observed_as_final",
      "direction": "subject-earlier-or-derivation-input-to-object-result",
      "subject_classes": [
        "runtime-state"
      ],
      "object_classes": [
        "final-runtime-record"
      ],
      "permitted_strengths": [
        "observation"
      ],
      "evidence_requirements": {
        "observation": [
          "final-runtime-record"
        ]
      },
      "lifecycle_requirement": "required",
      "closure_role": "final-endpoint",
      "meaning": "The exact runtime state is bound to the immutable final record in the selected snapshot and scope; observation alone does not assign source ownership."
    },
    {
      "predicate": "derives_explanation",
      "direction": "subject-earlier-or-derivation-input-to-object-result",
      "subject_classes": [
        "final-runtime-record"
      ],
      "object_classes": [
        "explanation"
      ],